{
  "$schema": "http://json-schema.org/draft-07/schema#",
  "title": "progress.json",
  "type": "object",
  "required": ["generated_at","branch","total_planned_tasks","completed_tasks","progress_percentage","completed_task_ids"],
  "properties": {
    "generated_at": {"type": "string"},
    "branch": {"type": "string"},
    "total_planned_tasks": {"type": "integer"},
    "completed_tasks": {"type": "integer"},
    "progress_percentage": {"type": "number"},
    "completed_task_ids": {"type": "array", "items": {"type": "string"}},
    "evidence": {"type": "object"},
    "notes": {"type": "string"}
  },
  "additionalProperties": true
}
