{
  "generated_at": "2025-11-27T15:30:00Z",
  "branch": "phase5/pilot-computeguard-clean",
  "total_planned_tasks": 81,
  "completed_tasks": 76,
  "progress_percentage": 94.0,
  "completed_task_ids": [
    "ATU-P3-C-01",
    "ATU-P3-P-01",
    "ATU-P3-P-04",
    "ATU-P3-C-02",
    "ATU-P3-C-03",
    "RULE-C-01",
    "EVAL-C-01",
    "EVAL-C-03",
    "EVAL-P-01",
    "ACC-005"
  ],
  "evidence": {
    "promoted_files": [
      "products/computeguard/schema.yml",
      "products/computeguard/rules/00_base_rule.yml"
    ],
    "artifacts": [
      "ai_reports/phase5_full_verification.json",
      "ai_reports/phase5_pilot_report.json",
      "ai_reports/phase5_flake8_raw_after.txt",
      "ai_reports/phase5_pilot_clean.patch"
    ],
    "tests": "pytest run: 48 passed (see ai_reports/pytest_summary.txt if present)",
    "lint": "flake8 run captured in ai_reports/phase5_flake8_raw_after.txt"
  },
  "notes": "This `progress.json` is a machine-readable snapshot of project progress supplied by the user. It is intended to be the authoritative input for automated checklist updates; it does not by itself prove every completed_task_id â€” please include commit hashes or exact artifact file paths for auditability when available."
}
